{
  "schema_version": "0.1",
  "manifestation_id": "KMN-000011",
  "parent_id": null,
  "domain": "structure",
  "abstraction_level": "ORDINARY_TARGET_CONCEPT",
  "source_supported_labels": [
    "巳宫巨门喜紫微天府、武曲、禄存、化禄等宫垣，不喜七杀、廉贞天相、贪狼等宫垣。"
  ],
  "source_rule_ids": [
    "P01-SG-175"
  ],
  "source_refs": [
    "SRC-ZZ-003#printed_page=17#P01-SG-175",
    "knowledge/palaces/P01_life/wp05/LIFE_P06_SOURCE_GAP_SUPPLEMENT_PP17_20_v0.1.csv#P01-SG-175"
  ],
  "output_kind": {
    "state": "KNOWN",
    "value": "TEMPORAL_SCOPE_UNSPECIFIED_CONTEXT_PREFERENCE"
  },
  "event_specificity": {
    "state": "KNOWN",
    "value": "ABSTRACT_CONTEXT_PREFERENCE_NOT_OBSERVED_EVENT"
  },
  "source_epistemic": "EXPLICIT",
  "normalization_epistemic": "SOURCE_PRESERVING",
  "review_provenance": {
    "review_status": "SOURCE_SPAN_VERIFIED",
    "reviewer_type": "MODEL_RESEARCH_REVIEW",
    "reviewer_id": "KB_CORE_WP06BC_CANONICAL_MAPPING_EXPANSION_DIVERSITY_02",
    "reviewed_at": "2026-10-29",
    "source_span_verified": true,
    "normalization_verified": true
  },
  "mapping_review_refs": [
    "MR-C1B2-P01SG175-CONTEXT-POS",
    "MR-C1B2-P01SG175-FORCETIME-NEG"
  ],
  "identity_rationale": "The identity is the source-preserved favorable/unfavorable palace-context preference for 巳宫巨门. The source lists palace contexts but does not specify whether they are decade, year, or another temporal layer.",
  "ambiguity_notes": [
    "The source names palace contexts without fixing a temporal layer."
  ],
  "unresolved_notes": [
    "来源未明说所列宫垣属于大运、流年或其他时间层；不得自动缩窄。"
  ],
  "probability_status": "UNKNOWN",
  "canonical_identity_status": "ACTIVE",
  "supersession": {
    "supersedes": [],
    "superseded_by": [],
    "reason": null
  }
}
