{
  "schema_version": "0.1",
  "manifestation_id": "KMN-000009",
  "parent_id": null,
  "domain": "timing",
  "abstraction_level": "ORDINARY_TARGET_CONCEPT",
  "source_supported_labels": [
    "辰戌破军以七杀、贪狼、紫相、天机巨门宫垣为流年大限之枢纽。"
  ],
  "source_rule_ids": [
    "P01-750"
  ],
  "source_refs": [
    "SRC-ZZ-003#printed_page=24#P01-750",
    "knowledge/palaces/P01_life/wp05/LIFE_P08_SOURCE_READJUDICATION_701_800_v0.1.csv#P01-750"
  ],
  "output_kind": {
    "state": "KNOWN",
    "value": "TEMPORAL_HINGE_STRUCTURE"
  },
  "event_specificity": {
    "state": "KNOWN",
    "value": "TEMPORAL_WINDOW_NOT_OBSERVED_EVENT"
  },
  "source_epistemic": "EXPLICIT",
  "normalization_epistemic": "SOURCE_PRESERVING",
  "review_provenance": {
    "review_status": "SOURCE_SPAN_VERIFIED",
    "reviewer_type": "MODEL_RESEARCH_REVIEW",
    "reviewer_id": "KB_CORE_WP06BC_CANONICAL_MAPPING_EXPANSION_DIVERSITY_01",
    "reviewed_at": "2026-10-29",
    "source_span_verified": true,
    "normalization_verified": true
  },
  "mapping_review_refs": [
    "MR-C1B1-P01750-TEMPORAL-POS",
    "MR-C1B1-P01750-EVENT-NEG"
  ],
  "identity_rationale": "The identity is the explicit dual-layer temporal hinge structure for 辰戌破军. It marks relevant 大限/流年 palace groups without asserting what concrete event or valence occurs there.",
  "ambiguity_notes": [
    "枢纽 identifies a relevant temporal window, not an event, outcome, probability, or automatic good/bad valence."
  ],
  "unresolved_notes": [],
  "probability_status": "UNKNOWN",
  "canonical_identity_status": "ACTIVE",
  "supersession": {
    "supersedes": [],
    "superseded_by": [],
    "reason": null
  }
}
