{
  "schema_version": "0.1",
  "manifestation_id": "KMN-000003",
  "parent_id": null,
  "domain": "career",
  "abstraction_level": "ORDINARY_TARGET_CONCEPT",
  "source_supported_labels": [
    "带血光象义的行业场景",
    "饮食、化验等工作场景"
  ],
  "source_rule_ids": [
    "CA05-469"
  ],
  "source_refs": [
    "SRC-ZZ-003#pdf_scan_page=72#printed_page=144#CA05-469",
    "knowledge/palaces/P09_career/wp06c/P09_WP06C_SOURCE_CANDIDATE_INDEX_v0.1.json#P09-WP06C-CAND-003",
    "knowledge/wp07a/CAREER_DIRECT_TRANSFORM_MAP_CA04_CA09_v0.1.json#CA05-469"
  ],
  "output_kind": {
    "state": "KNOWN",
    "value": "SCENE_OR_CONTEXT"
  },
  "event_specificity": {
    "state": "KNOWN",
    "value": "SCENE_NOT_OBSERVED_EVENT"
  },
  "source_epistemic": "EXPLICIT",
  "normalization_epistemic": "INFERRED",
  "review_provenance": {
    "review_status": "SOURCE_SPAN_VERIFIED",
    "reviewer_type": "MODEL_RESEARCH_REVIEW",
    "reviewer_id": "KB-CORE-WP06C-P09-FORMAL-MAPPING-REVIEW-PILOT-01",
    "reviewed_at": "2026-10-29",
    "source_span_verified": true,
    "normalization_verified": true
  },
  "mapping_review_refs": [
    "MR-P09-CA05469-SCENE-001",
    "MR-P09-CA05469-INJURY-NEG-002"
  ],
  "identity_rationale": "The canonical identity is the reviewed career/industry scene concept obtained by traceable normalization of the career-section source. G2A permits this INFERRED normalization. The explicit negative target review excludes person-level injury, illness, accident, or medical-event identity.",
  "ambiguity_notes": [
    "This node is a career/industry scene translation, not evidence that the person is injured, ill, in an accident, or undergoing a medical event."
  ],
  "unresolved_notes": [],
  "probability_status": "UNKNOWN",
  "canonical_identity_status": "ACTIVE",
  "supersession": {
    "supersedes": [],
    "superseded_by": [],
    "reason": null
  }
}
