{
  "schema_version": "0.1",
  "manifestation_id": "KMN-000004",
  "parent_id": null,
  "domain": "risk",
  "abstraction_level": "ORDINARY_TARGET_CONCEPT",
  "source_supported_labels": [
    "有煞曜空劫者，则主是非词讼。"
  ],
  "source_rule_ids": [
    "P05-SG-002"
  ],
  "source_refs": [
    "SRC-ZZ-003#printed_page=81#P05-SG-002",
    "knowledge/palaces/P05_wealth/w05/WEALTH_W05_SOURCE_GAP_SUPPLEMENT_v0.1.csv#P05-SG-002"
  ],
  "output_kind": {
    "state": "KNOWN",
    "value": "CONDITIONAL_RISK_STATE"
  },
  "event_specificity": {
    "state": "KNOWN",
    "value": "ABSTRACT_RISK_NOT_OBSERVED_EVENT"
  },
  "source_epistemic": "EXPLICIT",
  "normalization_epistemic": "INFERRED",
  "review_provenance": {
    "review_status": "SOURCE_SPAN_VERIFIED",
    "reviewer_type": "MODEL_RESEARCH_REVIEW",
    "reviewer_id": "KB_CORE_WP06BC_CANONICAL_MAPPING_EXPANSION_DIVERSITY_01",
    "reviewed_at": "2026-10-29",
    "source_span_verified": true,
    "normalization_verified": true
  },
  "mapping_review_refs": [
    "MR-C1B1-P05SG002-RISK-POS",
    "MR-C1B1-P05SG002-EVENT-NEG"
  ],
  "identity_rationale": "The identity is the source-bounded dispute-risk description attached to the 子午廉贞天相 context with the original 煞曜空劫 wording preserved. It is not a claim that litigation or dispute actually occurred.",
  "ambiguity_notes": [
    "The source wording 煞曜空劫 is preserved without assigning a Boolean trigger interpretation."
  ],
  "unresolved_notes": [
    "Trigger quantification for 煞曜空劫 remains unresolved; mapping execution therefore stays fail-closed."
  ],
  "probability_status": "UNKNOWN",
  "canonical_identity_status": "ACTIVE",
  "supersession": {
    "supersedes": [],
    "superseded_by": [],
    "reason": null
  }
}
