{
  "schema_version": "0.1",
  "manifestation_id": "KMN-000010",
  "parent_id": null,
  "domain": "timing",
  "abstraction_level": "ORDINARY_TARGET_CONCEPT",
  "source_supported_labels": [
    "辰宫巨门化禄，行至天府宫垣即为发迹大运。"
  ],
  "source_rule_ids": [
    "P01-SG-169"
  ],
  "source_refs": [
    "SRC-ZZ-003#printed_page=17#P01-SG-169",
    "knowledge/palaces/P01_life/wp05/LIFE_P06_SOURCE_GAP_SUPPLEMENT_PP17_20_v0.1.csv#P01-SG-169"
  ],
  "output_kind": {
    "state": "KNOWN",
    "value": "DECADE_BREAKTHROUGH_WINDOW"
  },
  "event_specificity": {
    "state": "KNOWN",
    "value": "TEMPORAL_WINDOW_NOT_OBSERVED_EVENT"
  },
  "source_epistemic": "EXPLICIT",
  "normalization_epistemic": "SOURCE_PRESERVING",
  "review_provenance": {
    "review_status": "SOURCE_SPAN_VERIFIED",
    "reviewer_type": "MODEL_RESEARCH_REVIEW",
    "reviewer_id": "KB_CORE_WP06BC_CANONICAL_MAPPING_EXPANSION_DIVERSITY_02",
    "reviewed_at": "2026-10-29",
    "source_span_verified": true,
    "normalization_verified": true
  },
  "mapping_review_refs": [
    "MR-C1B2-P01SG169-TIMING-POS",
    "MR-C1B2-P01SG169-EVENT-NEG"
  ],
  "identity_rationale": "The identity is the source-explicit decade breakthrough window for 辰宫巨门化禄 when the decade reaches a 天府 palace context. It is a timing structure, not proof that a concrete career or wealth event occurred.",
  "ambiguity_notes": [],
  "unresolved_notes": [],
  "probability_status": "UNKNOWN",
  "canonical_identity_status": "ACTIVE",
  "supersession": {
    "supersedes": [],
    "superseded_by": [],
    "reason": null
  }
}
